品牌,商场名,地址
麦德龙,华北 - 北京京顺路商场,北京市朝阳区京顺路111号
麦德龙,华北 - 北京十里河商场,北京市朝阳区大羊坊路35号
麦德龙,华北 - 北京立水桥商场,北京市朝阳区安立路3号1幢1层
麦德龙,华北 - 北京万泉河商场,北京市海淀区新建宫门路1号
麦德龙,华东 - 上海虹口商场,上海市虹口区广粤路418号
麦德龙,华东 - 上海嘉定商场,嘉定区宝安公路3718号(近永盛路)
麦德龙,华东 - 上海金山商场,上海市金山区城河路330号2栋1楼
麦德龙,华东 - 上海闵行商场,上海市闵行区顾戴路80号
麦德龙,华东 - 上海浦东商场,上海市浦东新区花木镇白杨路383号
麦德龙,华东 - 上海普陀商场,上海市普陀区真北路1425号
麦德龙,华东 - 上海松江商场,上海市松江区光星路1399号
麦德龙,华东 - 上海青浦商场,上海市青浦区崧文南路177号
麦德龙,华南 - 广州白云商场,广州白云机场路1518号首层
麦德龙,华南 - 广州花都商场,广州市花都区新华街凤凰南路田美城广场
麦德龙,华南 - 广州番禺商场,广东省广州市番禺区沙湾镇西环路1510号
麦德龙,华南 - 广州天河商场,广州黄埔大道中351号
麦德龙,华东 - 南京下关商场,江苏省南京市下关区建宁路300号
麦德龙,华东 - 南京雨花商场,南京市雨花台区卡子门大街98号
麦德龙,华东 - 杭州江干商场,浙江省杭州市江干区艮山东路355号
麦德龙,华东 - 杭州金家渡商场,杭州市莫干山路1459号
麦德龙,华东 - 芜湖商场,安徽省芜湖市弋江区利民东路70号
麦德龙,东北 - 长春净月商场,长春市净月经济开发区生态大街4567号
麦德龙,华北 - 济南槐荫商场,山东省济南市槐荫区党杨路一号
麦德龙,华中 - 长沙开福商场,湖南省长沙市开福区丽臣路115号
麦德龙,华中 - 长沙天心商场,湖南省长沙市天心区芙蓉南路二段390号
麦德龙,华中 - 长沙岳麓商场,湖南省长沙市岳麓区佑母塘路799号
麦德龙,华东 - 常州天宁商场,常州市龙城大道1297号
麦德龙,华东 - 常州武进商场,常州市武宜北路9号星河城市花园6区144号
麦德龙,西部 - 成都高新商场,成都市高新区天府二街1033号建发鹭州国际负一楼
麦德龙,西部 - 成都锦江商场,成都市锦江区上沙河堡街789号华宇广场B1
麦德龙,西部 - 成都青羊商场,成都市清江中路1号
麦德龙,西部 - 重庆北部新区商场,重庆市北部新区天福路63号
麦德龙,西部 - 重庆南岸商场,重庆市经济技术开发区白鹤路101号
麦德龙,东北 - 大连西岗商场,辽宁省大连市西岗区海防街59号
麦德龙,西部 - 德阳旌阳商场,德阳市泰山南路二段669号 
麦德龙,华南 - 东莞万江商场,广东省东莞市万江区金鳌大道北1号
麦德龙,华东 - 福州仓山商场,福建省福州市仓山区三高路162号
麦德龙,东北 - 哈尔滨道里商场,哈尔滨市道里区职工街1号
麦德龙,华东 - 合肥包河商场,安徽省合肥市美菱大道90号
麦德龙,华中 - 株洲商场,湖南省株洲市天元区珠江北路1036号
麦德龙,华东 - 淮安商场,江苏省淮安经济技术开发区深圳东路87号
麦德龙,华东 - 盐城商场,江苏省盐城市盐都区西环路295号
麦德龙,华东 - 宜兴商场,江苏省宜兴市阳泉西路803-809号
麦德龙,华东 - 张家港商场,张家港市经济技术开发区南二环路9号
麦德龙,华东 - 镇江开发区商场,江苏省镇江市镇江新区丁卯桥路312号
麦德龙,华东 - 江西九江商场,江西省九江市长虹西大道101号九方购物中心负一楼
麦德龙,华东 - 嘉兴经济开发区商场,浙江省嘉兴市城东路1487号
麦德龙,西部 - 昆明北辰商场,昆明市盘龙区北京路延长线1079号
麦德龙,西部 - 昆明广福商场,云南省昆明市滇池国家旅游度假区广福路1689号（大商汇对面）
麦德龙,华北 - 临沂罗庄商场,山东省临沂市罗庄区沂州路318号
麦德龙,华东 - 南昌红谷商场,江西省南昌市新建县长堎大道1581号
麦德龙,华东 - 南昌青山湖商场,南昌青云谱区洪都南大道368号
麦德龙,华东 - 南通崇川商场,江苏省南通市人民中路221号
麦德龙,华东 - 宁波慈溪商场,慈溪市汽贸大道399号
麦德龙,华东 - 宁波海曙商场,宁波海曙区丽园北路恒茂商业中心地下二层
麦德龙,华东 - 宁波鄞州商场,浙江省宁波市鄞州区麦德龙路1号
麦德龙,华东 - 莆田荔城商场,莆田市荔城区荔园南路1415号谊来印象一层
麦德龙,食品配送服务平台 - 青岛食品配送平台,青岛市经济技术开发区五台山路1517号
麦德龙,华北 - 青岛黄岛商场,青岛市经济技术开发区五台山路1517号
麦德龙,食品配送服务平台 - 无锡食品配送平台,无锡市新吴区硕放墙宅路1号
麦德龙,华北 - 青岛四方商场,山东省青岛市四方区重庆南路116号
麦德龙,华东 - 泉州丰泽商场,福建省泉州市丰泽区云鹿路111号
麦德龙,华北 - 潍坊商场,山东省潍坊市经济开发区北海路3333号
麦德龙,东北 - 沈阳浑南商场,辽宁省沈阳市东陵区浑南西路5号
麦德龙,东北 - 沈阳铁西商场,沈阳市铁西区兴工北街2号
麦德龙,华南-深圳宝安商场,深圳宝安区新安街道办前进路南侧冠城世家1栋1座A1A2
麦德龙,华南 - 深圳罗湖商场,深圳市罗湖区宝安北路4008号2号楼首层
麦德龙,华南 - 深圳南山商场,深圳市南山区沙河东路255号4栋
麦德龙,华东 - 常熟商场,江苏省常熟市通港路99号（靠近204国道）
麦德龙,华东 - 苏州高新区商场,江苏省苏州市高新区长江路579号
麦德龙,华东 - 苏州昆山商场,昆山市周市镇黄浦江北路200号
麦德龙,华东 - 苏州吴中商场,苏州市吴中区东方大道1号
麦德龙,华东 - 台州开发区商场 ,浙江省台州市市府大道东段666号
麦德龙,华北 - 天津滨海新区商场,天津经济技术开发区第二大街91号一层
麦德龙,华北 - 天津红桥商场,天津市红桥区西青道75号
麦德龙,华中 - 武汉洪山商场,武汉武昌区徐东路48号
麦德龙,华中 - 武汉汉阳商场,武汉市汉阳区芳草路97号
麦德龙,华中 - 武汉盘龙商场,湖北省武汉市黄陂区盘龙城经济开发区巨龙大道39号1号楼
麦德龙,华中 - 武汉硚口商场,湖北省武汉市硚口区解放大道144号
麦德龙,华东 - 无锡惠山商场,无锡市惠山区洛社镇洛城大道101号
麦德龙,华东 - 无锡江阴商场,江苏省江阴市绮山路318号
麦德龙,华东 - 无锡锡山商场,江苏省无锡市团结南路2号
麦德龙,华东 - 厦门湖里商场,福建省厦门市湖里区长浩路8号
麦德龙,西部 - 西安浐灞商场,西安市浐灞生态区北辰路958号
麦德龙,华中 - 襄阳高新区商场,湖北省襄阳市邓城大道67号
麦德龙,西部 - 西安雁塔商场,西安市长安南路86号
麦德龙,华东 - 徐州开发区商场,徐州市经济技术开发区徐海路8号环球港广场内
麦德龙,华东 - 扬州邗江商场,扬州市润扬中路115号
麦德龙,华北 - 烟台芝罘商场,山东烟台市芝罘区只楚路149号(烟台电视台对面)
麦德龙,华中 - 宜昌西陵商场,湖北省宜昌市体育场北路169号
麦德龙,西部 - 银川兴庆商场,银川市兴庆区丽景北街1号穆斯林国际商贸城内
麦德龙,华东 - 绍兴商场,绍兴市二环北路28号梦享城S-2楼
麦德龙,华中 - 郑州郑东商场,通泰路与商都路交叉口东南500米
麦德龙,华南 - 中山西区商场,广东省中山西区翠景北道61号
麦德龙,华北 - 淄博张店商场,山东省淄博市张店区山泉路102号
