品牌,商场名,地址,所属城市,格式化地址
沃尔玛,沃尔玛购物广场芜湖中山北路分店,安徽省芜湖市镜湖区中山北路与银湖南路交叉口,芜湖,安徽省芜湖市镜湖区北京东路86号
沃尔玛,沃尔玛购物广场六安梅山路分店,安徽省六安市金安区皖西路与梅山路交叉口 新都会环球广场负一层,六安,安徽省六安市金安区佛子岭中路
沃尔玛,沃尔玛购物广场阜阳人民东路分店,安徽省阜阳市颍泉区人民东路香港财富广场地下第一层,阜阳,安徽省阜阳市颍泉区界首路99号
沃尔玛,沃尔玛购物广场亳州魏武广场分店,亳州市光明路魏武广场西侧新天地国际购物中心地下第一层,亳州,安徽省亳州市谯城区光明路42
沃尔玛,沃尔玛购物广场合肥翡翠路分店,安徽省合肥市经济技术开发区芙蓉路与翡翠路交叉口港澳广场地上二、三层,合肥,安徽省合肥市蜀山区翡翠路398
沃尔玛,沃尔玛购物广场北京建国路分店,北京市朝阳区建国路93号院北京万达广场B座地下一层,北京,北京市朝阳区神路街33号
沃尔玛,沃尔玛购物广场北京昌平东关分店,北京市昌平区昌崔路203号果岭假日广场地上一层、二层、三层,北京,北京市昌平区政府街19号
沃尔玛,沃尔玛购物广场延庆妫guī水北街分店,北京市延庆区延庆镇妫水北街39号金锣湾商业中心地下一层,北京,北京市延庆县湖北西路1号
沃尔玛,沃尔玛购物广场北京清河分店,北京市海淀区清河中街68号五彩城二、三层 ,北京,北京市海淀区长春桥路17号
沃尔玛,沃尔玛购物广场北京宣武门分店,北京市西城区宣武门外大街32号富卓花园广场,北京,北京市西城区二龙路甲27号
沃尔玛,沃尔玛购物广场北京知春路分店,北京市海淀区知春路甲48号4号楼,北京,北京市海淀区长春桥路17号
沃尔玛,沃尔玛购物广场北京大郊亭分店,朝阳区东四环路189号美罗城购物中心地下第一层,北京,北京市朝阳区神路街33号
沃尔玛,沃尔玛购物广场北京阳光店,北京市朝阳区安立路68号飘亮购物中心负一层,北京,北京市朝阳区神路街33号
沃尔玛,沃尔玛购物广场北京世纪城分店,北京市海淀区板井路69号楼1层-负2层,北京,北京市海淀区长春桥路17号
沃尔玛,沃尔玛购物广场北京朝阳店,北京市朝阳区朝外大街12号,北京,北京市朝阳区神路街33号
沃尔玛,沃尔玛购物广场北京五棵松分店,北京市海淀区西翠路5号,北京,北京市海淀区长春桥路17号
沃尔玛,沃尔玛购物广场重庆九龙广场分店,重庆市九龙坡区杨家坪西郊三村2号,重庆,重庆市九龙坡区西郊路27号
沃尔玛,沃尔玛购物广场重庆冉家坝分店,重庆市渝北区龙山大道111号龙湖紫都城,重庆,重庆市渝北区渝松路377-387
沃尔玛,沃尔玛购物广场重庆松青路分店,重庆市大渡口区重庆市大渡口松青路负1-32号,重庆,重庆市大渡口区文体路126号9楼
沃尔玛,沃尔玛购物广场重庆北城天街分店,重庆市江北区北城天街33号负1-100,重庆,重庆市江北区五桂立交桥
沃尔玛,沃尔玛购物广场重庆凤天分店,重庆市沙坪坝区凤天大道29号附71,重庆,重庆市沙坪坝区凤天大道6号
沃尔玛,沃尔玛购物广场万州太白路分店,重庆市万州区太白路99号三峡福斯德广场负一层,重庆,重庆市万州区江南大道
沃尔玛,沃尔玛购物广场重庆渝北胜利路店,重庆市渝北区双凤桥街道胜利路129号金港国际购物中心,重庆,重庆市渝北区渝松路377-387
沃尔玛,沃尔玛购物广场永川渝西广场分店,重庆市永川区渝西大道中段918号地下第一层,重庆,重庆市永川区人民大道191号
沃尔玛, 沃尔玛购物广场重庆欣阳分店,重庆市沙坪坝区沙正街8号附1号,重庆,重庆市沙坪坝区凤天大道6号
沃尔玛, 沃尔玛购物广场重庆南坪店,重庆市南岸区南坪正街1号沃尔玛超市,重庆,重庆市南岸区
沃尔玛, 沃尔玛购物广场重庆大礼堂分店,重庆市渝中区人民路131,重庆,重庆市渝中区二府衙38号院
沃尔玛,沃尔玛购物广场福州鼓山店,福建省福州市晋安区招贤路1号,福州,福建省福州市晋安区福新中路128号-2号楼-7层
沃尔玛,沃尔玛购物广场福州浦上大道分店,福州市仓山区浦上大道276号仓山完蛋广场一区3号楼B1层,福州,福建省福州市仓山区闽江大道236号
沃尔玛,沃尔玛购物广场福州秀峰路分店,福州市晋安区新店镇坂中路6号 泰禾城市广场地下1层,福州,福建省福州市晋安区福新中路128号-2号楼-7层
沃尔玛,沃尔玛购物广场福州大利嘉分店,福州市台江区五一中路169号大利嘉城B区沃尔玛,福州,福建省福州市台江区新玉环路81号-14
沃尔玛,沃尔玛购物广场福州长城分店,福建省福州市鼓楼区六一北路615号长城广场沃尔玛购物广场,福州,福建省福州市鼓楼区省府路57号
沃尔玛, 沃尔玛购物广场福州联信店,福州市五一南路1号联信大厦,福州,福建省福州市台江区江滨路126
沃尔玛, 沃尔玛购物广场福州东街店,福州市鼓楼区东街口杨桥东路8号,福州,福建省福州市鼓楼区省府路57号
沃尔玛, 沃尔玛购物广场福州五里亭分店,福州市晋安区福马路199号,福州,福建省福州市晋安区福新中路128号-2号楼-7层
沃尔玛, 沃尔玛购物广场福州则徐分店,福州市仓山区则徐大道379号,福州,福建省福州市仓山区闽江大道236号
沃尔玛, 沃尔玛购物广场福州富贵店,福州市鼓楼区东大路18号沃尔玛富贵店,福州,福建省福州市鼓楼区省府路57号
沃尔玛,沃尔玛购物广场漳州丹霞路分店,福建省漳州市芗城区丹霞路122-124号凯德广场2-3楼沃尔玛,漳州,福建省漳州市芗城区南昌路96号
沃尔玛,沃尔玛购物广场晋江SM分店,福建省晋江市福埔开发区SM国际广场负一楼,晋江,福建省泉州市晋江市X317(福兴路)
沃尔玛,沃尔玛购物广场泉州江滨北路分店,泉州市鲤城区江滨北路沃尔玛,泉州,福建省泉州市鲤城区庄府巷24
沃尔玛,沃尔玛购物广场石狮九二路分店,福建省石狮市九二路1118号狮城国际广场2-3F,石狮,福建省泉州市石狮市九二东路
沃尔玛,沃尔玛购物广场厦门洪文店,厦门市思明区莲前东路123号加州城市广场负二楼,厦门,福建省厦门市思明区民族路40号
沃尔玛,沃尔玛购物广场厦门海沧滨湖分店,厦门市海沧区滨湖北二路阿罗海城市广场60-80号,厦门,福建省厦门市海沧区沧湖北路729号
沃尔玛,沃尔玛购物广场厦门金山路分店,厦门市湖里区仙岳路与金山路交叉口万达广场负一层；,厦门,福建省厦门市湖里区枋湖南路204号
沃尔玛,沃尔玛购物广场厦门SM分店,福建省厦门市嘉禾路468号SM城市广场一期负一楼沃尔玛商场,厦门,福建省厦门市思明区嘉禾路439号
沃尔玛,沃尔玛购物广场厦门世贸分店,福建省厦门市厦禾路888号世贸商城地下一层沃尔玛购物广场,厦门,福建省厦门市思明区厦禾路1228号
沃尔玛, 沃尔玛购物广场厦门富山店,福建省厦门市思明区厦门湖滨南路398号,厦门,福建省厦门市思明区民族路40号
沃尔玛, 沃尔玛购物广场厦门聚祥分店,福建省厦门市禾祥西路609号聚祥沃尔玛,厦门,福建省厦门市思明区湖滨中路39号
沃尔玛, 沃尔玛购物广场厦门东分店,厦门市思明区莲前东路288号瑞景商业广场负一层,厦门,福建省厦门市思明区民族路40号
沃尔玛,沃尔玛购物广场莆田文献东路分店,莆田市荔城区仓后路三信金鼎广场地下第一层,莆田,福建省莆田市荔城区胜利北街245号
沃尔玛,沃尔玛购物广场莆田涵江分店,福建省莆田市涵江区塘北路288号地上二层、地上三层,莆田,福建省莆田市涵江区兴涵街1号-3号楼
沃尔玛,沃尔玛购物广场长乐广场路分店,长乐市航城街道广场路长乐长山湖广场地上第二、三层,长乐,福建省福州市长乐市吴航路27号
沃尔玛,沃尔玛购物广场宁德天湖东路分店,宁德市东侨区天湖东路8号宁德东方伟业广场地上第二、三层,宁德,福建省宁德市蕉城区薛令之路5号
沃尔玛,沃尔玛购物广场南安成功街分店,南安市柳城街道办事处成功街中段南侧东方伟业城市广场地上第二、三层,南安,福建省泉州市南安市  
沃尔玛,沃尔玛购物广场三明列东街分店,福建省三明市梅列区徐碧街东方伟业广场二、三层,三明,福建省三明市梅列区江南路238号
沃尔玛,沃尔玛购物广场福鼎天湖路分店,福建省宁德市福鼎市五里牌天湖大道中汇广场第十三号楼2-3层,福鼎,福建省宁德市福鼎市太姥大道612号
沃尔玛,沃尔玛购物广场霞浦太康路分店,福建省宁德市霞浦县太康路363号,霞浦县,福建省宁德市霞浦县府前路2号
沃尔玛, 沃尔玛购物广场福清融侨店,福建省福清市国际商展中心一层,福清,福建省福州市福清市清昌大道
沃尔玛,沃尔玛购物广场佛山桂城分店,广东省佛山市南海区桂城南海大道北75号凯德广场负一层沃尔玛,佛山,广东省佛山市南海区南海大道北88号
沃尔玛,沃尔玛购物广场佛山季华分店,广东省佛山市禅城区季华五路36号印象城2-4层,佛山,广东省佛山市禅城区岭南大道北80号
沃尔玛,沃尔玛购物广场顺德东乐路分店,佛山市顺德区大良街道东乐路新一城购物广场地下第一层,佛山,广东省佛山市顺德区德民路6号
沃尔玛,沃尔玛购物广场佛山高明东华路分店,佛山市高明区荷城街道东华路31号京柏城购物广场地上第二、三层,佛山,广东省佛山市高明区沿江路29号
沃尔玛,沃尔玛购物广场佛山南海桂澜中路分店,广东省佛山市南海区桂城街道桂澜中路18号中海寰宇天下花园15座中海环宇城负一楼,佛山,广东省佛山市南海区南海大道北88号
沃尔玛, 沃尔玛购物广场佛山季华分店,佛山市禅城区季华路12号,佛山,广东省佛山市禅城区岭南大道北80号
沃尔玛, 沃尔玛购物广场佛山怡东店,佛山市禅城区锦华路85号东方广场之明珠城负一层,佛山,广东省佛山市禅城区岭南大道北80号
沃尔玛,沃尔玛购物广场东莞鸿福路分店,东莞市南城区鸿福路90号凯德广场2-3层,东莞,广东省东莞市东莞市市辖区莞太大道篁村路段51号
沃尔玛,沃尔玛购物广场东莞长安广场分店,长安镇长青街长安明珠广场负一层、一、二、三层部分,东莞,广东省东莞市东莞市市辖区长青北路
沃尔玛,沃尔玛购物广场东莞凤岗中心分店,东莞市凤岗镇永盛北路1号财富新地大厦地上第二、三层,东莞,广东省东莞市东莞市市辖区政通路1
沃尔玛,沃尔玛购物广场黄江环城路分店,广东省东莞市黄江镇环城路星光城购物中心一、二层,东莞,广东省东莞市东莞市市辖区西进路23
沃尔玛,沃尔玛购物广场莞城凤来路分店,东莞市莞城区凤来路和向阳路交汇处西城楼大街北区4号楼,东莞,广东省东莞市东莞市市辖区新沙坊65号
沃尔玛,沃尔玛购物广场东莞南城宏图路分店,广东省东莞市南城区宏图路中天中央广场二、三层,东莞,广东省东莞市东莞市市辖区莞太大道篁村路段51号
沃尔玛,沃尔玛购物广场东莞塘厦莲湖分店,东莞市塘厦镇塘厦大道中79号盈锋莲湖广场地上第二层及地上第三层,东莞,广东省东莞市东莞市市辖区迎宾大道15-d号
沃尔玛,沃尔玛购物广场东莞大岭山玉屏路分店,东莞市大岭山镇矮岭冚107国道旁领尚天地第10栋集中商业区二三楼。,东莞, 广东省东莞市东莞市市辖区大岭山镇
沃尔玛,沃尔玛购物广场大朗富华中路分店,东莞市大朗镇富华中路181号,东莞,广东省东莞市东莞市市辖区美景中路1
沃尔玛,沃尔玛购物广场东莞石龙东升路分店,东莞市石龙镇中山东社区东升路18号汇星商业中心1号商业楼地上第二层及地上第三层,东莞,广东省东莞市东莞市市辖区太平路82号
沃尔玛,沃尔玛购物广场东莞东湖店,广东省东莞市城区东纵大道东湖花园首层,东莞,广东省东莞市东莞市市辖区光明路14
沃尔玛, 沃尔玛购物广场东莞世博分店,东莞市东城区岗贝东城大道世博广场B区首层至三层,东莞,广东省东莞市东莞市市辖区旗峰路
沃尔玛, 沃尔玛购物广场东莞长安分店,东莞市长安镇霄边大街208号阳光国际商城霄边沃尔玛,东莞,广东省东莞市东莞市市辖区长青北路
沃尔玛, 沃尔玛购物广场东莞虎门分店,东莞市虎门镇太沙路64号虎门德兴花园步行街A-G栋,东莞,广东省东莞市东莞市市辖区虎门大道127号
沃尔玛,沃尔玛购物广场湛江康顺路分店,湛江椹川大道北376号凯德广场二、三楼,湛江,广东省湛江市赤坎区椹川大道北376号
沃尔玛,沃尔玛购物广场湛江人民大道南分店,湛江市霞山区人民大道南与民享西路交汇处国贸城市广场地下第一、二层、地上第一、五层,湛江,广东省湛江市霞山区解放西路22
沃尔玛,沃尔玛购物广场遂溪遂海路分店,广东省湛江市遂溪县遂城镇遂海路36号的全丰中央广场地下第一层,湛江,广东省湛江市遂溪县中山路131号
沃尔玛, 沃尔玛购物广场湛江赤坎店,广东省湛江市赤坎区中山一路2号世贸大厦首层至三层,湛江,广东省湛江市赤坎区椹川大道北101号
沃尔玛,沃尔玛购物广场茂名文化广场分店,广东省茂名市西粤中路8号,茂名,广东省茂名市茂南区油城九路2号
沃尔玛,沃尔玛购物广场韶关新华南路分店,韶关市武江区新华南路16号世纪新城广场2-3层,韶关,广东省韶关市武江区惠民南路91号
沃尔玛,沃尔玛购物广场肇庆端州四路分店,肇庆市端州四路牌坊广场东侧凯德广场2~3楼,肇庆,广东省肇庆市端州区端州三路37号
沃尔玛,沃尔玛购物广场肇庆康乐北路分店,肇庆市康乐北路9号国际新天地地上第二、三层,肇庆,广东省肇庆市端州区康乐北路32号
沃尔玛,沃尔玛购物广场肇庆广宁环城东路分店,肇庆市广宁县南街镇环城东路广宁商业步行街F区地上第一、二层,肇庆,广东省肇庆市广宁县环城东路
沃尔玛,沃尔玛购物广场拱北迎宾南路分店,珠海市岭南路68号负一层商业,珠海,广东省珠海市香洲区桂花北路91号
沃尔玛,沃尔玛购物广场珠海前山分店,广东省珠海市香洲区前山招商花园城二期沃尔玛购物广场,珠海,广东省珠海市香洲区翠景路93号
沃尔玛,沃尔玛购物广场中山港义路分店,广东省中山市火炬开发区东镇东一路23号负一层,中山,广东省中山市中山市市辖区康乐三街
沃尔玛,沃尔玛购物广场英德利民路分店,英德市英城建设路东利民路南英州明珠广场二、三层,英德,广东省清远市英德市浈阳路9号
沃尔玛,沃尔玛购物广场吴川同德城分店,广东省吴川市同德路128号同德城地上第二、三层,吴川,广东省湛江市吴川市新安路104号
沃尔玛,沃尔玛购物广场广州白云新城分店,广东省广州市白云区云城南二路187号103房,广州,广东省广州市白云区广园中路238号3216房
沃尔玛, 沃尔玛购物广场广州天河店,广州市天河区天河棠下村口中山大道南,广州,广东省广州市天河区天府路1
沃尔玛, 沃尔玛购物广场广州海珠分店,广州市海珠区昌岗中路221号信和豪庭地下一层,广州,广东省广州市海珠区广州大道南999号
沃尔玛, 沃尔玛购物广场广州广源分店,广州市白云区广源新村景泰直街33号,广州,广东省广州市白云区广园中路238号3216房
沃尔玛, 沃尔玛购物广场广州淘金分店,广州市越秀区淘金路淘金街6-8号,广州,广东省广州市越秀区中山四路235号
沃尔玛, 沃尔玛购物广场广州番禺分店,广东省广州市番禺区石基镇东兴路476号,广州,广东省广州市番禺区清河东路辅路
沃尔玛, 沃尔玛购物广场广州广雅分店,广州市荔湾区环市西路52号,广州,广东省广州市荔湾区中山七路330号
沃尔玛, 沃尔玛购物广场广州新市店,广东省广州市白云区机场路1111号,广州,广东省广州市白云区广园中路238号3216房
沃尔玛, 沃尔玛购物广场广州云景分店,广州市白云区同和中云景路4号,广州,广东省广州市白云区广园中路238号3216房
沃尔玛, 沃尔玛购物广场广州黄埔店,广州是黄埔区石化路123号,广州,广东省广州市黄埔区南岗街22号
沃尔玛, 沃尔玛购物广场广州黄花岗店,广州市越秀区先烈中路92号黄花岗文化广场商贸楼二\三楼,广州,广东省广州市越秀区中山四路235号
沃尔玛, 沃尔玛购物广场广州新港店,广东省广州市海珠区新港中路356号丽影广场负一、二层,广州,广东省广州市海珠区广州大道南999号
沃尔玛, 沃尔玛购物广场广州南洲店,广州市海珠区盈中路好信街8号好信广场,广州,广东省广州市海珠区广州大道南999号
沃尔玛, 沃尔玛购物广场广州芳村店,广州市荔湾区花地大道北93-103号花地城广场地下负一层、首至三层,广州,广东省广州市荔湾区中山七路330号
沃尔玛, 沃尔玛购物广场广州黄石分店,广州市白云区黄石东路120号盈月居首层至负一层商场,广州,广东省广州市白云区广园中路238号3216房
沃尔玛,沃尔玛购物广场惠州文明一路分店,惠州市惠城区江北18号小区意生购物广场地下第一层,惠州,广东省惠州市惠城区新联路1号
沃尔玛,沃尔玛购物广场惠州鹅岭西路分店,惠州市鹅岭西路31号百利通广场第一层,惠州,广东省惠州市惠城区鹅岭北路2号
沃尔玛,沃尔玛购物广场惠州澳头分店,广东省惠州大亚湾区安惠大道64号蓝湾半岛二楼,惠州,广东省惠州市惠阳区白云三路34号
沃尔玛,沃尔玛购物广场惠州仲恺大道分店,惠州市仲恺高新区陈江街道金湖路1号,惠州,广东省惠州市惠城区仲恺大道辅路
沃尔玛,沃尔玛购物广场惠州崇雅分店,广东省惠州市惠阳区淡水镇南门北路印象汇广场2-3层,惠州,广东省惠州市惠阳区白云三路34号
沃尔玛,沃尔玛购物广场惠州演达路分店,惠州市惠城区河南岸港惠新天地二、三层,惠州,广东省惠州市惠城区新联路1号
沃尔玛,沃尔玛购物广场惠东飞鹅岭分店,广东省惠州市惠东县平山惠东大道489号沃尔玛飞鹅岭分店,惠州,广东省惠州市惠东县解放中路135-2
沃尔玛,沃尔玛购物广场汕头金砂东路分店,汕头市金砂路179号合信星湖商业城地下一层(帝豪酒店斜对面）,汕头,广东省汕头市龙湖区金砂东路
沃尔玛,沃尔玛购物广场河源中山大道分店,河源市源城区中山大道218号 万隆城广场地下一层,河源,广东省河源市源城区公园东路1号
沃尔玛,沃尔玛购物广场河源越王大道分店,河源市源城区越王大道139号负一楼,河源,广东省河源市源城区公园东路1号
沃尔玛,沃尔玛购物广场阳江西平北路分店,广东省阳江市江城区西平北路363号地上第二层和地上第三层,阳江,广东省阳江市江城区漠江路749号
沃尔玛,沃尔玛购物广场廉江廉江大道分店,广东省湛江市廉江市百信国际广场沃尔玛廉江大道分店,廉江,广东省湛江市廉江市石城路1
沃尔玛,沃尔玛购物广场清远先锋东路分店,广东省清远市清城区先锋东路3号世纪荟广场,清远,广东省清远市清城区院环西路
沃尔玛,沃尔玛购物广场普宁广达北路分店,广东省揭阳市普宁市流沙市区环市北路南侧广达北路东侧,普宁,  广东省揭阳市普宁市
沃尔玛,沃尔玛购物广场深圳中山分店,深圳市罗湖区凤凰路12号中山花园裙楼1-3楼沃尔玛购物广场,深圳,广东省深圳市罗湖区湖贝路4
沃尔玛,沃尔玛购物广场深圳福星分店,福田区福星路福民楼D、E、F、1-2楼,深圳,广东省深圳市福田区福民路105号
沃尔玛,沃尔玛购物广场深圳蛇口分店,蛇口工业大道四海加油站右侧,深圳,广东省深圳市南山区南新路3173号
沃尔玛,沃尔玛购物广场深圳华侨城分店,深圳市华侨城中旅广场群楼沃尔玛,深圳,广东省深圳市南山区兴隆西街2号
沃尔玛,沃尔玛购物广场深圳西乡前进路分店,深圳市宝安西乡前进一路482号沃尔玛,深圳,广东省深圳市宝安区裕安二路162号
沃尔玛,沃尔玛购物广场深圳布吉大芬分店,深圳市龙岗区布吉镇大芬村深惠公路旁龙吉大厦一至三层,深圳,广东省深圳市龙岗区东南路4号
沃尔玛,沃尔玛购物广场深圳洪湖店,深圳市罗湖区洪湖路湖景花园,深圳,广东省深圳市罗湖区湖贝路4
沃尔玛,沃尔玛购物广场深圳布吉锦龙路分店,深圳市龙岗区布吉锦龙路万科生活广场负一层沃尔玛,深圳,广东省深圳市龙岗区东南路4号
沃尔玛,沃尔玛购物广场松岗东方大道分店,深圳市宝安区松岗街道东方大道36号联投东方PARK-B1001铺,深圳,广东省深圳市宝安区创业路1号
沃尔玛,沃尔玛购物广场龙岗龙平东路分店,深圳市龙岗区龙平东路203号东方瑞景苑A区地上第二、三层,深圳,广东省深圳市龙岗区东南路4号
沃尔玛,沃尔玛购物广场深圳燕南路分店,深圳市福田区燕南路88号中泰燕南名庭二楼、三楼,深圳,广东省深圳市福田区福民路105号
沃尔玛,沃尔玛购物广场深圳景田分店,深圳市福田区香梅北路2001号（原山姆会员店）,深圳,广东省深圳市福田区福民路105号
沃尔玛,沃尔玛购物广场深圳横岗西分店,深圳市龙岗区龙岗大道（横岗段）2999麟恒中心广场一期127号商铺,深圳,广东省深圳市龙岗区东南路4号
沃尔玛,沃尔玛购物广场深圳龙岗建设路分店,深圳市龙岗中心城5区建设路28号宝钜商业大厦,深圳,广东省深圳市龙岗区五联一路
沃尔玛,沃尔玛购物广场深圳龙岗峦山谷分店,深圳市龙岗区宝龙工业城振业峦山谷花园（一期）2、3栋商场复式117号大厦地上第一层,深圳,广东省深圳市龙岗区东南路4号
沃尔玛,沃尔玛购物广场深圳宝安沙井分店,广东省深圳市宝安区沙井镇沙井街道新沙路西荟城购物广场,深圳,广东省深圳市宝安区创业路1号
沃尔玛,沃尔玛购物广场深圳龙华人民南路分店,深圳龙华新区人民南路水榭春天负一层,深圳,广东省深圳市宝安区丰益路3
沃尔玛,沃尔玛购物广场深圳宝安金海路分店,广东省深圳市宝安区宝安大道与金海路交汇处金港华庭沃尔玛地上1-3层,深圳,广东省深圳市宝安区创业路1号
沃尔玛,沃尔玛购物广场深圳新安罗田分店,深圳市宝安区新湖路君逸世家地下第一层及地上第一层,深圳,广东省深圳市宝安区创业路1号
沃尔玛, 沃尔玛购物广场深圳翠竹分店,广东省深圳市罗湖区翠竹路旭飞华达园负一层,深圳,广东省深圳市罗湖区湖贝路4
沃尔玛, 沃尔玛购物广场深圳大益店,深圳市宝安区西乡大道大益广场商场1-3层,深圳,广东省深圳市宝安区创业路1号
沃尔玛, 沃尔玛购物广场深圳红岭店,深圳市福田区八卦二路旭飞花园B栋1-2层,深圳,广东省深圳市福田区福民路105号
沃尔玛, 沃尔玛购物广场深圳嘉宾店,广东省深圳市罗湖区书城路1号都市名园裙楼,深圳,广东省深圳市罗湖区湖贝路4
沃尔玛, 沃尔玛购物广场深圳坪地龙岗大道分店,深圳市龙岗区坪地街道龙岗大道3018号宜城广场A区1楼01号铺、A区负1楼01号铺,深圳,广东省深圳市龙岗区东南路4号
沃尔玛,沃尔玛购物广场南宁朝阳路分店,广西南宁市兴宁区青云街18号悦荟广场沃尔玛,南宁,广西壮族自治区南宁市兴宁区厢竹大道63号-5楼-514号
沃尔玛,沃尔玛购物广场南宁民族大道分店,广西南宁市青秀区南宁民族大道131号航洋国际购物中心负二层,南宁,广西壮族自治区南宁市青秀区仙葫大道1号-5楼
沃尔玛,沃尔玛购物广场南宁明秀西路分店,南宁市西乡塘区明秀西路111号正恒国际广场负一楼,南宁,广西壮族自治区南宁市西乡塘区衡阳西路6号
沃尔玛,沃尔玛购物广场南宁永和路分店,广西省南宁市西乡塘区永和路19号沃尔玛超市,南宁,广西壮族自治区南宁市西乡塘区衡阳西路6号
沃尔玛,沃尔玛购物广场南宁长堽西路分店,南宁市兴宁区望州南路90号时代茗城,南宁,广西壮族自治区南宁市兴宁区厢竹大道63号-5楼-514号
沃尔玛,沃尔玛购物广场桂林中山北路分店,桂林市叠彩区中山北路597号广运美居沃尔玛,桂林,广西壮族自治区桂林市叠彩区凤北路8号
沃尔玛,沃尔玛购物广场钦州钦州湾大道分店,广西钦州市钦州湾大道年年丰广场地上第二/三层,钦州,广西壮族自治区钦州市钦南区新阳街7
