品牌,商场名,地址,所属城市,格式化地址
沃尔玛,沃尔玛购物广场广西来宾桂中大道分店,广西省来宾市桂中大道368号大地景苑 方盛广场,来宾,广西壮族自治区来宾市兴宾区政和路
沃尔玛,沃尔玛购物广场梧州新兴二路分店,梧州市新兴二路130号,梧州,广西壮族自治区梧州市长洲区新兴二路6-8号
沃尔玛,沃尔玛购物广场贵阳沙冲路分店,贵州省 贵阳市南明区 沙冲路 贵铁新苑地下一层,贵阳,贵州省贵阳市南明区箭道街48号
沃尔玛,沃尔玛购物广场贵阳人民广场分店,贵州省贵阳市南明区遵义路人民广场地下商场,贵阳,贵州省贵阳市南明区箭道街48号
沃尔玛,沃尔玛购物广场贵阳贵乌北路分店,贵州省贵阳市贵乌北路187号中大国际,贵阳,贵州省贵阳市云岩区贵乌北路2号
沃尔玛,沃尔玛购物广场贵阳黄河路店,贵州省贵阳市小河区黄河路42号沃尔玛购物广场,贵阳,贵州省贵阳市花溪区G321(沪瑞线)
沃尔玛,沃尔玛购物广场贵阳林城西路分店,贵州省贵阳市观山湖区诚信北路8号,贵阳,贵州省贵阳市乌当区育新路1号
沃尔玛,沃尔玛购物广场六盘水钟山中路分店,贵州省六盘水市钟山中路沃尔玛购物广场钟山中路分店,六盘水,贵州省六盘水市钟山区中山中路66号
沃尔玛,沃尔玛购物广场遵义春天堡分店,遵义市红花岗区外环路财富国际广场地上第二、三层　,遵义,贵州省遵义市红花岗区G210(包南线)
沃尔玛,沃尔玛购物广场遵义纪念广场分店,贵州省遵义市红花岗区老城新街A区沃尔玛（贵州）百货有限公司遵义纪念广场分店,遵义,贵州省遵义市红花岗区G210(包南线)
沃尔玛,沃尔玛购物广场毕节文博路分店,贵州省毕节市七星关区南部新区招商花园城沃尔玛,毕节市,贵州省毕节市七星关区开行路
沃尔玛,沃尔玛购物广场廊坊朝阳分店,河北省廊坊市广阳区爱民道与和平路交口,廊坊,河北省廊坊市广阳区康宁道2号
沃尔玛,沃尔玛购物广场保定朝阳大街分店,河北省保定市新市区朝阳北大街99号 万博广场负一层,保定,河北省保定市新市区五四西路318号
沃尔玛,沃尔玛购物广场邯郸东柳大街分店,邯郸市丛台路与东柳大街交叉口中道广场地下第一层,邯郸,河北省邯郸市邯郸县丛台路
沃尔玛,沃尔玛购物广场石家庄南三条分店,唐山市路南区新华东道100号万达广场负一层沃尔玛超市,唐山,河北省唐山市路南区新华西道68号
沃尔玛,,河北省邢台市桥东区中兴东大街18号世贸天街负一层沃尔玛超市,邢台,河北省邢台市桥东区凤凰街10号
沃尔玛,沃尔玛购物广场三河燕郊神威北路分店,河北省廊坊市三河市燕郊开发区神威北路与燕灵路交汇处鑫乐汇购物广场负一层,三河,河北省廊坊市三河市
沃尔玛,沃尔玛购物广场哈尔滨友谊路分店,黑龙江省哈尔滨道里区友谊路187号,哈尔滨,黑龙江省哈尔滨市道里区安化街136号
沃尔玛,沃尔玛购物广场哈尔滨先锋路分店,哈尔滨市道外区先锋路475号,哈尔滨,黑龙江省哈尔滨市道里区安化街136号
沃尔玛, 沃尔玛购物广场哈尔滨十字街分店,黑龙江哈尔滨市南岗区十字街58号,哈尔滨,黑龙江省哈尔滨市道里区安化街136号
沃尔玛, 沃尔玛购物广场哈尔滨安埠分店,黑龙江省哈尔滨市香坊区安埠街300号,哈尔滨,黑龙江省哈尔滨市道里区安化街136号
沃尔玛,沃尔玛购物广场齐齐哈尔解放门分店,齐齐哈尔市清真路18号中瑞商城地上第二层及第三层,齐齐哈尔,黑龙江省齐齐哈尔市建华区广信路76号
沃尔玛,沃尔玛购物广场安阳人民大道分店,河南省安阳市北关区人民大道86号,安阳,河南省安阳市北关区灯塔路185
沃尔玛,沃尔玛购物广场郑州中原西路分店,河南省郑州市中原区中原路与秦岭路交汇处万达广场地下第一层,郑州,河南省郑州市中原区桐柏北路200号
沃尔玛,沃尔玛购物广场商丘民主路分店,河南省商丘市梁园区民主路与凯旋路交叉口向西100米路北,商丘,河南省商丘市梁园区锦绣路6号
沃尔玛,沃尔玛购物广场信阳人民路分店,河南省信阳市浉河区人民路与民权路交叉口,信阳,河南省信阳市浉河区行政大道6号
沃尔玛,沃尔玛购物广场鹤壁鹤煤大道分店,河南省鹤壁市鹤煤大道与兴鹤大街交叉口417号银兴国际广场2至3层,鹤壁,河南省鹤壁市淇滨区鹤煤大道
沃尔玛,沃尔玛购物广场武汉中山大道分店,武汉市江汉区民生路176路,武汉,湖北省武汉市江汉区新华路255号
沃尔玛,沃尔玛购物广场武汉徐东大街分店,湖北省武汉市武昌区徐东大街18#,武汉,湖北省武汉市武昌区中山路307号
沃尔玛,沃尔玛购物广场武汉汉西店,武汉市硚口区解放大道201号大武汉家装G栋地上第二、三层,武汉,湖北省武汉市硚口区沿河大道518号
沃尔玛,沃尔玛购物广场武汉王家湾店,湖北省武汉市汉阳区龙阳大道特6号,武汉,湖北省武汉市汉阳区芳墨路
沃尔玛,沃尔玛购物广场武汉南湖花园分店,湖北省武汉市武昌区武汉市武昌区丁字桥南路520号南湖城市广场地上第二、三层,武汉,湖北省武汉市武昌区中山路307号
沃尔玛,沃尔玛购物广场武汉钟家村分店,湖北省武汉市汉阳大道137号汉商银座F栋地下一层沃尔玛购物广场,武汉,湖北省武汉市汉阳区汉阳大道138号
沃尔玛,沃尔玛购物广场武汉光谷分店,湖北省武汉市东湖新技术开发区关山大道475号,武汉,湖北省武汉市洪山区高新大道辅路
沃尔玛,沃尔玛购物广场武汉黄陂广场分店,武汉市黄陂区黄陂达到黄陂广场第二、三层,武汉,湖北省武汉市黄陂区黄陂大道388号
沃尔玛,沃尔玛购物广场武汉马场角分店,武汉市江汉区新华西路菱角湖万达广场地下第一层,武汉,湖北省武汉市江汉区新华路255号
沃尔玛,沃尔玛购物广场武汉和平大道分店,武汉市青山区和平大道809号奥山世纪城地下一层,武汉,湖北省武汉市青山区临江大道811号
沃尔玛,沃尔玛购物广场武汉沌口分店,武汉市经济开发区东风大道111号经开万达广场室内步行街负一层,武汉,湖北省武汉市蔡甸区G318(东风大道)
沃尔玛,沃尔玛购物广场武汉东西湖店,武汉市东西湖区东吴大道1160号海林·阳光城地上二、三层,武汉,湖北省武汉市东西湖区东吴大道75号
沃尔玛, 沃尔玛购物广场武汉长青店,湖北省武汉市江岸区黄兴路28号,武汉,湖北省武汉市江岸区六合路1号
沃尔玛, 沃尔玛购物广场武汉杨家湾分店,武汉市洪山区卓刀泉路271号五环天地负一层 ,武汉,湖北省武汉市洪山区珞狮路318号
沃尔玛,沃尔玛购物广场荆州北京中路分店,湖北荆州市沙市区北京中路平安美佳华购物广场2、3层,荆州,湖北省荆州市沙市区文化宫路7-7
沃尔玛,沃尔玛购物广场襄阳长虹路分店,湖北省襄阳市樊城区长虹路民发商业广场2、3楼,襄阳,湖北省襄阳市樊城区长虹路23号
沃尔玛,沃尔玛购物广场宜昌夷陵广场分店,宜昌市夷陵路22号中心商务区购物中心广场地上第二、三层,宜昌,湖北省宜昌市西陵区夷陵大道58-5
沃尔玛,沃尔玛购物广场宜昌九码头分店,宜昌市伍家岗区沿江大道万达广场地下第一层,宜昌,湖北省宜昌市伍家岗区八一路2号
沃尔玛,沃尔玛购物广场荆门虎牙关大道分店,湖北省荆门市虎牙关大道11号星球商业中心负一楼,荆门,湖北省荆门市掇刀区虎牙关大道1号
沃尔玛,沃尔玛购物广场黄石武汉路分店,沃尔玛购物广场黄石武汉路分店,黄石,湖北省黄石市黄石港区湖滨大道
沃尔玛,沃尔玛购物广场咸宁温泉路店,湖北省咸宁市温泉路35号,咸宁,湖北省咸宁市咸安区银泉大道630号
沃尔玛,沃尔玛购物广场将军路店,麻城市将军路54号和陵园路交汇处麻城广场,麻城,湖北省黄冈市麻城市G106(京广线)
沃尔玛,沃尔玛购物广场黄冈红安沿河路分店,湖北省黄冈市红安县沿河路11号盛地沃尔玛广场地上二楼至三楼,黄冈,湖北省黄冈市红安县小北街10号
沃尔玛,沃尔玛购物广场赤壁河北大道分店,湖北省赤壁市河北大道47号地上第二层至地上第三层,赤壁, 湖北省咸宁市赤壁市 
沃尔玛,沃尔玛购物广场天门新城分店,湖北省天门市开发区西湖南路1号,天门,湖北省天门市创业大道辅路
沃尔玛,沃尔玛购物广场洪湖宏伟南路分店,洪湖市宏伟南路天远时代广场A区,洪湖,湖北省荆州市洪湖市宏伟南路31-18号
沃尔玛,沃尔玛购物广场汉川西正街分店,湖北省汉川市仙女山街道办事处西正街汉海国际广场2-3楼,汉川, 湖北省孝感市汉川市 
沃尔玛,沃尔玛购物广场应城分店,湖北省应城市蒲阳大道特8号（中央广场）,应城市, 湖北省孝感市应城市 
沃尔玛,沃尔玛购物广场仙桃黄金大道分店,中国湖北省仙桃市宏达南路1号,仙桃, 湖北省仙桃市 
沃尔玛,沃尔玛购物广场孝感长征路分店,湖北省孝感市长征路23号保丽国际广场,孝感,湖北省孝感市孝南区长征路
沃尔玛,沃尔玛购物广场长沙雨花亭分店,长沙市雨花区韶山中路421号凯德广场2-3层沃尔玛购物广场,长沙,湖南省长沙市雨花区万家丽中路
沃尔玛,沃尔玛购物广场长沙梅溪湖分店,湖南省长沙市岳麓区环湖路1177号金茂广场负二楼,长沙,湖南省长沙市岳麓区金星北路1段-517
沃尔玛,沃尔玛购物广场长沙黄兴南路分店,湖南省长沙市天心区黄兴南路443号悦荟购物广场2-3楼 ,长沙,湖南省长沙市天心区湘府中路298号
沃尔玛,沃尔玛购物广场岳阳巴陵中路分店,湖南省岳阳市巴陵中路泰和商业广场一楼、二楼沃尔玛岳阳分店,岳阳,湖南省岳阳市岳阳楼区巴陵中路559号
沃尔玛,沃尔玛购物广场岳阳青年东路分店,岳阳市岳阳楼区青年东路与通海路交汇处鑫公馆,岳阳,湖南省岳阳市岳阳楼区巴陵中路513号
沃尔玛,沃尔玛购物广场娄底春园分店,湖南省娄底市娄星区春园商业步行街银街沃尔玛负一楼,娄底,湖南省娄底市娄星区长青中街3号
沃尔玛,沃尔玛购物广场娄底大汉路分店,湖南省娄底市经济技术开发区香茅街五江建材城2-3城,娄底,湖南省娄底市娄星区大汉大道辅路
沃尔玛,沃尔玛购物广场娄底新化分店,湖南省娄底市新化县梅苑南路 世贸城市广场,娄底,湖南省娄底市新化县科苑路
沃尔玛,沃尔玛购物广场郴州五岭广场分店,郴州市五岭广场新天地二 、三楼,郴州,湖南省郴州市北湖区五岭路6号
沃尔玛,沃尔玛购物广场益阳桃花仑西路分店,益阳市桃花仑西路555号益阳深国投商业中心地上第二层及地上第三层,益阳,湖南省益阳市赫山区龙洲北路586号
沃尔玛,沃尔玛购物广场攸县大巷路分店,湖南省株洲市攸县城关镇大巷路东华商业广场地上第二、三层,株洲,湖南省株洲市攸县望云路165
沃尔玛,沃尔玛购物广场株洲神农城分店,湖南省株洲市天元区珠江南路599号神农太阳城大厦第一层,株洲,湖南省株洲市天元区株洲大道北1
沃尔玛,沃尔玛购物广场冷水江锑都中路分店,湖南省冷水江市锑都中路与新城路交汇处东苑国际商业广场地上第二层至第三层,冷水江,湖南省娄底市冷水江市锑都中路
沃尔玛,沃尔玛购物广场包头文化路分店,内蒙古包头市青山区幸福路4号时代财富城地下第一层,包头,内蒙古自治区包头市青山区建设路
沃尔玛,沃尔玛购物广场鄂尔多斯分店,内蒙古自治区鄂尔多斯市东胜区准格尔北路16号,鄂尔多斯,内蒙古自治区呼和浩特市赛罕区敕勒川大街
沃尔玛,沃尔玛购物广场通辽和平路分店,内蒙古通辽市科尔沁区永清大街与和平路交口,通辽,内蒙古自治区通辽市科尔沁区霍林河大街908
沃尔玛,赤峰玉龙大街分店,内蒙古赤峰市松山区-新城区玉龙大街与天义路交汇处上海城地下第一层（市政府南侧）,赤峰市,内蒙古自治区赤峰市松山区松山大街
沃尔玛,沃尔玛购物广场常州通江中路分店,江苏省常州市新北区通江中路88号万达广场负一楼,常州,江苏省常州市新北区衡山路8号
沃尔玛,沃尔玛购物广场扬州四望亭路分店,江苏省扬州市邗江区扬子江路与四望亭路交叉口东北角,扬州,江苏省扬州市邗江区兴城西路170
沃尔玛,沃尔玛购物广场太仓府南街分店,江苏省苏州市太仓市城厢镇府南街21号,太仓,江苏省苏州市太仓市惠阳路39号
沃尔玛,沃尔玛购物广场镇江谷阳路分店,镇江市新区丁卯桥路北与谷阳路东交界处的沃得广场地上第二、三层,镇江,江苏省镇江市京口区银环路
沃尔玛,沃尔玛购物广场吴江江兴西路分店,江苏省苏州市吴江区江兴西路469号正翔商业广场二楼,吴江,江苏省苏州市吴江区人民路1000号
沃尔玛,沃尔玛购物广场徐州解放路分店,江苏省徐州市云龙区和平路与解放路交叉口,徐州,江苏省徐州市云龙区和平大道
沃尔玛,沃尔玛购物广场南京桥北路分店,江苏省南京市浦口区大桥北路58号,南京,江苏省南京市浦口区文德路18
沃尔玛,沃尔玛购物广场南京水西门大街分店,南京市建邺区江东中路98号万达广场地下第一层及地上第二、三层,南京,江苏省南京市建邺区江东中路269号-19楼
沃尔玛,沃尔玛购物广场南京赛虹桥分店,南京市雨花台区应天大街619号虹悦城负一层,南京,江苏省南京市雨花台区雨花南路2号
沃尔玛,沃尔玛购物广场南京新街口分店,南京市秦淮区洪武路88号悦荟广场2-3楼,南京,江苏省南京市秦淮区太平南路86-1号
沃尔玛, 沃尔玛购物广场南京秦淮店,南京市秦淮区长乐路132号,南京,江苏省南京市秦淮区太平南路86-1号
沃尔玛, 沃尔玛购物广场南京迈皋桥店,南京市和燕路348号,南京,江苏省南京市栖霞区和燕路456-1
沃尔玛,沃尔玛购物广场如皋中山西路分店,江苏省如皋市中山西路1号,如皋,江苏省南通市如皋市中山西路8号
沃尔玛, 沃尔玛购物广场无锡太湖店,无锡市春申路69号,无锡,江苏省无锡市惠山区永安路
沃尔玛, 沃尔玛购物广场无锡金城店,江苏省无锡市南长区五星家园123号,无锡,江苏省无锡市崇安区解放南路688
沃尔玛, 沃尔玛购物广场苏州南门店,苏州市东吴北路288号,苏州,江苏省苏州市吴中区东吴北路1号
沃尔玛,沃尔玛购物广场南昌解放西路分店,江西省南昌市青云谱区解放西路87号,南昌,江西省南昌市青云谱区井冈山大道338号
沃尔玛,沃尔玛购物广场南昌八一广场分店,江西省南昌市东湖区八一大道北333号南昌沃尔玛八一店,南昌,江西省南昌市东湖区叠山路136号
沃尔玛,沃尔玛购物广场南昌青山南路店,江西省南昌市东湖区青山南路72号蓝天碧水沃尔玛,南昌,江西省南昌市东湖区叠山路136号
沃尔玛, 沃尔玛购物广场南昌象湖店,江西省南昌市青云谱区三店西路488号,南昌,江西省南昌市青云谱区井冈山大道338号
沃尔玛,沃尔玛购物广场南昌县澄湖东路分店,江西南昌县莲塘镇澄湖东路1111号沃尔玛,南昌县,江西省南昌市南昌县府前西路3号
沃尔玛,沃尔玛购物广场景德镇广场南路分店,江西省景德镇市珠山区广场南路开门子购物广场B1层,景德镇,江西省景德镇市珠山区中山北路277号
沃尔玛,沃尔玛购物广场九江庐山南路分店,江西省九江市庐山南路265-267号名湖广场第二、三层,九江,江西省九江市浔阳区长虹大道62号
沃尔玛,沃尔玛购物广场鹰潭站江路分店,鹰潭胜利西路29号沃尔玛购物广场,鹰潭,江西省鹰潭市月湖区胜利东路1号
沃尔玛,沃尔玛购物广场抚州赣东大道店,江西省抚州市赣东大道345号地下一层、地下二层,抚州,江西省抚州市临川区赣东大道339号
沃尔玛,沃尔玛购物广场丰城人民路分店,江西省丰城市建设路133号,丰城,江西省宜春市丰城市建设路8
沃尔玛,沃尔玛购物广场萍乡绿茵广场分店,江西省萍乡市安源区凤凰街绿茵广场地下二层,萍乡,江西省萍乡市安源区萍安中大道
沃尔玛,沃尔玛购物广场新余抱石公园分店,江西省新余市公园北路68号高能广场沃尔玛,新余,江西省新余市渝水区公园北路13号
沃尔玛,沃尔玛购物广场吉安人民广场分店,江西省吉安市吉州区人民广场北新世界广场地下一层,吉安,江西省吉安市吉州区汗青路
沃尔玛,沃尔玛购物广场分宜县府前路分店,江西省新余市分宜县府前路1号梦时代广场,分宜,江西省新余市分宜县广府路
沃尔玛,沃尔玛购物广场长春前进广场分店,吉林省长春市高薪技术开发区前进大街2058号,长春,吉林省长春市宽城区龙湖大路辅路
沃尔玛,沃尔玛购物广场长春临河街分店,长春市经济技术开发区临河街3157号天地十二坊天地大厦地下一层,长春,吉林省长春市南关区大庆路
沃尔玛,沃尔玛购物广场长春博学路分店,长春市净月开发区博学路1555号,长春,吉林省长春市南关区福祉大路1572号
沃尔玛,沃尔玛购物广场长春重庆路分店,吉林省长春市朝阳区重庆路1268号,长春,吉林省长春市朝阳区前进大街1710
沃尔玛,沃尔玛购物广场松原伯都讷大街分店,松原市宁江区伯都讷南街1号东镇城市广场 ,松原,吉林省松原市宁江区文化路1号
沃尔玛,沃尔玛购物广场大连新天地广场分店,辽宁省大连市西安路福佳新天地99D沃尔玛百货有限公司,大连,辽宁省大连市西岗区华北路11-5号
沃尔玛,沃尔玛购物广场大连周水前店,大连市甘井子区华北路（甘）10C-B1-2号,大连,辽宁省大连市甘井子区虹韵路1号
沃尔玛,沃尔玛购物广场大连金州五一路分店,辽宁省大连市金州新区光明街道北山路1416号,大连,辽宁省大连市金州区解放路690号
沃尔玛,沃尔玛购物广场大连奥林匹克广场店,大连市西岗区奥林匹克广场2号,大连,辽宁省大连市西岗区大胜街69号
沃尔玛,沃尔玛购物广场大连华南分店,辽宁省大连市甘井子区中华西路6号,大连,辽宁省大连市甘井子区虹韵路1号
沃尔玛, 沃尔玛购物广场大连安盛分店,大连市开发区金马路195号,大连,辽宁省大连市金州区辽河东路9号
沃尔玛, 沃尔玛购物广场大连学苑分店,辽宁省大连市沙河口区数码路南段15号-3层,大连,辽宁省大连市沙河口区太原街3号
沃尔玛, 沃尔玛购物广场大连旅顺分店,辽宁省大连市旅顺口区黄河路26.26-9号,大连,辽宁省大连市旅顺口区新城大街1号
沃尔玛,沃尔玛购物广场沈阳长青店,辽宁省沈阳市沈河区长青街121号,沈阳,辽宁省沈阳市沈河区盛京路34号
沃尔玛,沃尔玛购物广场沈阳太原街分店,沈阳市和平区中华路9号,沈阳,辽宁省沈阳市和平区十一纬路74号
沃尔玛,沃尔玛（辽宁）百货有限公司锦州解放路分店,辽宁省锦州市凌河区五段33号 地下一层,锦州,辽宁省锦州市凌河区解放路五段25号
沃尔玛,沃尔玛购物广场西安金花南路分店,陕西省西安市碑林区金花南路6号,西安,陕西省西安市碑林区二环南路西段-69号
沃尔玛,沃尔玛购物广场西安骡马市分店,西安市碑林区东大街骡马市1号兴正元广场南区地下一层,西安,陕西省西安市碑林区二环南路西段-69号
沃尔玛,沃尔玛购物广场西安未央路分店,陕西省西安市未央区凤城五路富力广场1-4层,西安,陕西省西安市未央区未央路42号
沃尔玛,沃尔玛购物广场西安雁塔路店,西安市碑林区雁塔路西安万达商业广场地下第一层,西安,陕西省西安市碑林区二环南路西段-69号
沃尔玛, 沃尔玛购物广场西安莲湖分店,陕西省西安市西大街276号安定广场3号楼,西安,陕西省西安市莲湖区西大街276号
沃尔玛,沃尔玛购物广场淄博柳泉路分店,山东省淄博市张店区柳泉路67号,淄博,山东省淄博市张店区张周路8号
沃尔玛,沃尔玛购物广场潍坊东风东街分店,山东省潍坊市奎文区东风东街7819号沃尔玛购物广场,潍坊,山东省潍坊市奎文区胜利东街
沃尔玛,沃尔玛购物广场神道路分店,山东省济宁市任城区玄帝庙街太白商业广场地上一二层,济宁,山东省济宁市任城区
沃尔玛,沃尔玛购物广场济南泉城路分店,山东省济南市历下区泉城路339号,济南,山东省济南市历下区解放东路99号
沃尔玛,沃尔玛购物广场烟台天府街分店,山东省青岛市市北区台东三路63号,青岛,山东省青岛市市北区延吉路82号
沃尔玛,沃尔玛购物广场上海南浦大桥店,浦东新区临沂北路252-262号由由-沃尔玛购物广场地上一层和地上二层,上海,上海市浦东新区世纪大道2001号-1号楼-15楼
沃尔玛,沃尔玛购物广场上海五角场分店,上海市杨浦区淞沪路125号,上海,上海市杨浦区江浦路549号-901室
沃尔玛,沃尔玛购物广场上海江桥分店,上海市嘉定区江桥镇曹安公路2200号嘉莲华购物广场地上二、三层,上海,上海市嘉定区嘉戬公路93号
沃尔玛,沃尔玛购物广场上海松江松汇路分店,上海市松江区松汇中路568号三楼,上海,上海市松江区园中路1号
沃尔玛,沃尔玛购物广场上海高行分店,上海市浦东新区东靖路1881号万嘉商业广场地上第二、三层,上海,上海市浦东新区世纪大道2001号-1号楼-15楼
沃尔玛,沃尔玛购物广场上海桃浦分店,上海市普陀区桃浦镇武威路1178号白丽生活广场B1层,上海,上海市普陀区大渡河路1668号
沃尔玛,沃尔玛购物广场上海三林分店,上海市浦东新区东明路2766号三林城市商业广场地下第一层,上海,上海市浦东新区世纪大道2001号-1号楼-15楼
沃尔玛,沃尔玛购物广场上海顾村分店,上海市宝山区沪太路4929号,上海,上海市宝山区密山路4号
沃尔玛,沃尔玛购物广场上海杨行分店,上海市宝山区水产路2599号,上海,上海市宝山区密山路4号
沃尔玛,沃尔玛购物广场上海宝山一二八纪念路分店,宝山区一二八纪念路988弄2号地下一层,上海,上海市宝山区密山路4号
沃尔玛,上海施湾分店,上海市浦东新区祝桥镇施镇路施镇路256弄1号,上海,上海市浦东新区世纪大道2001号-1号楼-15楼
沃尔玛, 沃尔玛购物广场上海上南店,上海市浦东新区齐河路258号,上海,上海市浦东新区世纪大道2001号-1号楼-15楼
沃尔玛, 沃尔玛购物广场上海田林分店,上海市徐汇区上海市徐汇区桂林路402号74幢,上海,上海市徐汇区漕溪北路348号
沃尔玛, 沃尔玛购物广场上海甘泉店,上海市普陀区平利路18号,上海,上海市普陀区大渡河路1668号
沃尔玛, 沃尔玛购物广场上海凌云分店,上海室徐汇区老沪闵路809号,上海,上海市徐汇区龙华西路31弄7号甲
沃尔玛, 沃尔玛购物广场上海祁连山店,上海市宝山区聚丰园路205号,上海,上海市宝山区密山路4号
沃尔玛, 沃尔玛购物广场上海虹桥店,上海市闵行区虹中路535号,上海,上海市闵行区沪闵路6258号
沃尔玛,沃尔玛购物广场太原长风街分店,太原市小店区长风街705号和信商座地下一层沃尔玛,太原,山西省太原市小店区西大街2号
沃尔玛,沃尔玛购物广场太原三墙路分店,山西省太原市杏花岭区三墙路东大盛世华庭2-3层,太原,山西省太原市杏花岭区胜利街287号
沃尔玛,沃尔玛购物广场大同永泰分店,山西省大同市城区永泰南路航空广场地下一层,大同,山西省大同市城区迎宾西路30号
沃尔玛,沃尔玛购物广场阳泉桃北东路分店,山西省阳泉市城区桃北东路,阳泉,山西省阳泉市城区南大街39号
沃尔玛,沃尔玛购物广场运城河东东街分店,山西省运城市盐湖区河东东街与学苑路交叉口东北角,运城,山西省运城市盐湖区市府街11号
沃尔玛,沃尔玛购物广场孝义崇文街分店,沃尔玛（山西）商业零售有限公司孝义崇文街分店,孝义,山西省吕梁市孝义市崇文大街
沃尔玛,沃尔玛购物广场晋中安宁街分店,山西省晋中市榆次区安宁街290号,晋中,山西省晋中市榆次区迎宾西街辅路
沃尔玛,沃尔玛购物广场成都交大路分店,四川省成都市金牛区交大路183号,成都,四川省成都市金牛区沙湾路65
沃尔玛,沃尔玛购物广场成都SM广场分店,成都市成华区二环路东二段29号SM广场沃尔玛,成都,四川省成都市成华区双林路196号
沃尔玛,沃尔玛购物广场成都羊西线蜀西路分店,成都市高新西区汇川路288号,成都,四川省成都市郫县西源大道8号
