品牌,商场名,地址,所属城市,格式化地址
沃尔玛,沃尔玛购物广场成都华府大道分店,四川省成都市天府新区华府大道一段688号益州国际广场沃尔玛,成都,四川省成都市双流县天府大道南段辅路
沃尔玛,沃尔玛购物广场金堂新建路分店,成都市金堂县赵镇新建路133号,成都,四川省成都市金堂县十里大道1段-800号
沃尔玛, 沃尔玛购物广场成都亚太分店,成都武侯区科华北路58号亚太广场沃尔玛,成都,四川省成都市武侯区武候祠大街264号
沃尔玛, 沃尔玛购物广场成都府河分店,成都市青羊区北大街100号,成都,四川省成都市青羊区王家塘街111号
沃尔玛, 沃尔玛购物广场成都武侯店,成都市武侯区高升桥东路2-6号,成都,四川省成都市武侯区武候祠大街264号
沃尔玛, 沃尔玛购物广场成都玉林店,四川省成都市一环路南三段22号,成都,四川省成都市成华区新鸿路261号
沃尔玛, 沃尔玛购物广场成都西城分店,成都市青羊区石人北路50号,成都,四川省成都市青羊区王家塘街111号
沃尔玛, 沃尔玛购物广场成都双流分店,成都市双流区东升街道南昌路1-9号,成都,四川省成都市双流县丛桂街15-、17-、19号
沃尔玛,沃尔玛购物广场宜宾酒都路分店,四川省宜宾市翠屏区酒都路中段55号沃尔玛购物广场,宜宾,四川省宜宾市翠屏区人民路100号
沃尔玛,沃尔玛购物广场达州朝阳东路分店,四川省达州市通川区朝阳东路中心广场滨江名都城,达州,四川省达州市通川区通川路196号
沃尔玛,沃尔玛购物广场德阳天山北路分店,德阳市天山北路6号德阳深国投商业中心地上第二层及地上第三层,德阳,四川省德阳市旌阳区长江东路20号
沃尔玛,沃尔玛购物广场遂宁嘉禾西路分店,四川省遂宁市船山区嘉禾西路近水楼台商业广场,遂宁,四川省遂宁市船山区嘉禾东路55号
沃尔玛,沃尔玛购物广场乐山土桥街分店,四川省乐山市市中区嘉瑞财富广场鼓楼街58号,乐山,四川省乐山市市中区县街146
沃尔玛,沃尔玛购物广场西昌航天大道分店,四川省凉山西昌市西昌市航天大道二段世纪MALL购物中心第二、三层,西昌,四川省凉山彝族自治州西昌市胜利南路88号
沃尔玛,沃尔玛购物广场彭州金彭东路分店,四川省成都市彭州市金彭东路122号,彭州,四川省成都市彭州市金彭东路
沃尔玛,沃尔玛购物广场攀枝花炳草岗分店,攀枝花市攀枝花大道东段439号云锦金瓯广场地下第一层,攀枝花,四川省攀枝花市东区攀枝花大道东段-483号
沃尔玛,沃尔玛购物广场攀枝花清香坪分店,四川省攀枝花市西区苏铁中路88号,攀枝花,四川省攀枝花市西区苏铁中路260号
沃尔玛,沃尔玛购物广场江油太白路分店,四川省绵阳市江油市涪江路中段614号汇元国际商业广场,江油,四川省绵阳市江油市涪江路东段
沃尔玛,沃尔玛购物广场自贡汇兴路分店,四川省自贡市自流井区龙汇街新汇社区居委会4组新美居家三期8栋,自贡,四川省自贡市自流井区丹桂大街196号
沃尔玛,沃尔玛购物广场自贡荣县分店,自贡市荣县旭阳镇望景路356号,自贡,四川省自贡市荣县体育场路
沃尔玛,沃尔玛购物广场阆中人民广场分店,四川省阆中市保宁街道办事处郎家拐街54号人民广场购物中心地下第一层,阆中,四川省南充市阆中市官菜园街12号
沃尔玛,沃尔玛购物广场巴中巴人广场分店,巴中市江北区广场街87号地下第一层,巴中,四川省巴中市巴州区吊桥街153号
沃尔玛,沃尔玛购物广场眉山杭州路分店,眉山市三苏大道168号,眉山, 四川省眉山市东坡区 
沃尔玛,沃尔玛购物广场峨眉名山东路分店,四川省峨眉山市名山东路与佛光南路交汇处,峨眉山,四川省乐山市峨眉山市佛光东路1号
沃尔玛,沃尔玛购物广场绵阳跃进路分店,四川省绵阳市涪城区跃进路48-52号,绵阳,四川省绵阳市涪城区文庙街8号
沃尔玛,沃尔玛购物广场绵阳绵兴东路分店,四川省绵阳市绵兴东路56号中沅广场负一楼,绵阳,四川省绵阳市涪城区临园路西段-75-fu1
沃尔玛,沃尔玛购物广场绵阳临园路分店,四川省绵阳市临园东路74号,绵阳,四川省绵阳市涪城区临园路中段-54号
沃尔玛, 沃尔玛购物广场绵阳西分店,绵阳市涪城区临园路西段72号东辰新天地沃尔玛,绵阳,四川省绵阳市涪城区文庙街8号
沃尔玛, 沃尔玛购物广场绵阳店,四川省绵阳市涪城区公园路1号兴达广场,绵阳,四川省绵阳市涪城区文庙街8号
沃尔玛,沃尔玛购物广场广汉福州路分店,四川省广汉市福州路二段1号,广汉,四川省德阳市广汉市福州路
沃尔玛,沃尔玛购物广场崇州唐安东路分店,四川省成都市崇州市唐安东路368号,崇州,四川省成都市崇州市崇庆中路494号
沃尔玛, 沃尔玛购物广场南充五星店,四川省南充市顺庆区模范街2号大都会负一楼,南充,四川省南充市顺庆区果城路11号
沃尔玛, 沃尔玛购物广场成都都江堰分店,都江堰市建设路111号天和盛世,都江堰,四川省成都市成华区建设路9-26号
沃尔玛,沃尔玛购物广场武清泉州路分店,天津市武清区泉州路东侧荔隆时代广场2-3层,天津,天津市武清区雍阳西道118号
沃尔玛,沃尔玛购物广场天津新开路分店,天津市河东区华昌大街北侧嘉华国际商业大厦地下1-3层,天津,天津市河东区泰兴南路32号
沃尔玛,沃尔玛购物广场天津和平路分店,深圳沃尔玛百货零售有限公司天津和平路分店,天津, 天津市和平区 
沃尔玛,沃尔玛购物广场昆明霖雨路分店,云南省昆明市五华区霖雨路中汇商场三楼,昆明,云南省昆明市五华区华山西路1
沃尔玛,沃尔玛购物广场昆明兴苑路分店,昆明市西山区兴苑路张家村525号驣辉商业广场地上第二、三层,昆明,云南省昆明市西山区兴苑路30号
沃尔玛,沃尔玛购物广场昆明云山路分店,云南省昆明市西山区明波土堆村50号,昆明,云南省昆明市西山区兴苑路30号
沃尔玛,沃尔玛购物广场昆明前兴路分店,昆明市西山区拥护社区居民委员会拥护村理想城市花园地下第一层,昆明,云南省昆明市西山区兴苑路30号
沃尔玛,沃尔玛购物广场昆明昌源中路分店,云南省昆明市昌源中路与昆瑞路交叉路口假日城市小区,昆明,云南省昆明市五华区昌源中路3号
沃尔玛,沃尔玛购物广场昆明万宏路分店,云南省昆明市盘龙区万宏路20号,昆明,云南省昆明市盘龙区北京路辅路
沃尔玛,沃尔玛购物广场宜良鱼龙街分店,云南省昆明市宜良县鱼龙街与花园街交叉口东北角愿景城市广场沃尔玛,昆明,云南省昆明市宜良县温泉路6-16
沃尔玛,沃尔玛购物广场昆明大观店,云南省昆明市五华区小西门大观商业城北面E1-E2座1-3层,昆明,云南省昆明市五华区华山西路1
沃尔玛,沃尔玛购物广场昆明集大分店,云南省昆明市环城东路188号,昆明,云南省昆明市官渡区东郊路12号
沃尔玛,沃尔玛购物广场昆明国贸中心分店,云南省昆明市官渡区春城路289号国贸中心北侧沃尔玛,昆明,云南省昆明市官渡区老昆洛路152号
沃尔玛, 沃尔玛购物广场昆明喜相逢店,云南省昆明市盘龙区人民东路63号,昆明,云南省昆明市盘龙区北京路辅路
沃尔玛, 沃尔玛购物广场昆明新迎店,昆明市盘龙区白龙路199号,昆明,云南省昆明市盘龙区北京路辅路
沃尔玛, 沃尔玛购物广场昆明金瓦路分店,昆明市盘龙区金瓦路与东三环交叉口福缇商业中心负一层,昆明,云南省昆明市盘龙区北京路辅路
沃尔玛,沃尔玛购物广场大理泰安路分店,云南省大理市下关镇洱河北路与泰安路交叉口中民城市广场沃尔玛超市,大理,云南省大理白族自治州大理市龙溪路52号
沃尔玛,沃尔玛购物广场大理建设路分店,大理市建设路和泰安路交叉口物业的B1&1F,大理,云南省大理白族自治州大理市兴盛路2号
沃尔玛,沃尔玛购物广场曲靖交通路分店,云南省曲靖市麒麟区交通路与麒麟北路交叉口 ,曲靖,云南省曲靖市麒麟区南宁西路28号
沃尔玛,沃尔玛购物广场曲靖子午路分店,云南省曲靖市南片区子午路和文笔路交叉口,曲靖,云南省曲靖市麒麟区云玉路
沃尔玛,沃尔玛购物广场个旧金湖分店,云南省个旧市五一路4号,个旧,云南省红河哈尼族彝族自治州个旧市金湖南路5号
沃尔玛,沃尔玛购物广场楚雄府后街分店,云南省楚雄市府后街1-21号紫溪商业中心沃尔玛购物广场,楚雄,云南省楚雄彝族自治州楚雄市府后街2-、4-、6-、8号
沃尔玛,沃尔玛购物广场楚雄团结路分店,云南省楚雄楚雄市团结路与北浦路交叉口伟业广场,楚雄,云南省楚雄彝族自治州楚雄市团结路
沃尔玛,沃尔玛购物广场普洱林源路分店,云南省普洱市思茅区林源路创基商城沃尔玛,普洱,云南省普洱市思茅区过街楼44
沃尔玛,沃尔玛购物广场景洪勐海路分店,西双版纳傣族自治州景洪市勐海路4号,西双版纳景洪市,云南省西双版纳傣族自治州景洪市勐海路55号
沃尔玛,沃尔玛购物广场文山东风路分店,云南省文山州文山市东风路光大广场负一楼,文山,云南省文山壮族苗族自治州文山市西华路137
沃尔玛,沃尔玛购物广场弥勒髯翁路分店,云南省弥勒市弥阳镇金辰时代广场负一楼,红河州弥勒,云南省红河哈尼族彝族自治州弥勒县拖白路184号
沃尔玛,沃尔玛购物广场建水东林路分店,云南省红河州建水县临安镇广慈路东林路旁,红河州建水,云南省红河哈尼族彝族自治州建水县建水大道647
沃尔玛,沃尔玛购物广场昭通环城东路分店,云南省昭通市昭阳区环城东路与环城北路交叉口,昭通,云南省昭通市昭阳区振兴路
沃尔玛,沃尔玛购物广场云南玉溪东风广场分店,云南省玉溪市红塔区东风中路1号,玉溪,云南省玉溪市红塔区聂耳路27号
沃尔玛,沃尔玛购物广场宣威文化路分店,云南省宣威市城双路33号泰和财富中心大厦负一层,宣威,云南省曲靖市宣威市双圩路37号
沃尔玛,沃尔玛购物广场临沧沧江路分店,云南省临沧市临翔区沧江路恒基广场,临沧,云南省临沧市临翔区白塔路101号
沃尔玛,沃尔玛购物广场丽江香格里拉大道分店,云南省丽江市古城区香格里大道祥和商业广场,丽江,云南省丽江市古城区福慧路450号
沃尔玛,沃尔玛购物广场金华时代广场分店,金华市八一北街108号,金华,浙江省金华市婺城区八一北街106号
沃尔玛,沃尔玛购物广场浦江大桥北路分店,浙江省金华市浦江县浦阳街道人民东路33号财富广场的地下第一层,金华,浙江省金华市浦江县人民东路40号
沃尔玛,沃尔玛购物广场武义俞源街分店,浙江省武义县俞源街与西溪路交汇处金灿财富广场,金华,浙江省金华市武义县壶山下街130-7
沃尔玛,沃尔玛购物广场杭州东新分店,杭州市香积寺东路58号,杭州,浙江省杭州市下城区长浜路200号
沃尔玛,沃尔玛购物广场杭州古墩路分店,浙江省杭州市西湖区古墩路588号印象城3-4楼,杭州,浙江省杭州市西湖区浙大路3-5号
沃尔玛,沃尔玛购物广场富阳分店,杭州富阳区富春街道横凉亭路6号复城国际中心2号楼,杭州,浙江省杭州市富阳市桂花路27-～1号
沃尔玛, 沃尔玛购物广场杭州黄龙店,浙江省杭州市西湖区灵隐街道曙光路黄龙体育中心沃尔玛超市,杭州,浙江省杭州市西湖区浙大路3-5号
沃尔玛, 沃尔玛购物广场杭州近江店,浙江省杭州市上城区秋涛支路近江路１号,杭州,浙江省杭州市上城区惠民路48号
沃尔玛,沃尔玛购物广场嘉兴洪兴路分店,嘉兴市秀洲区洪兴路与新洲路交叉口江南摩尔广场,嘉兴,浙江省嘉兴市秀洲区洪兴路1805号
沃尔玛,沃尔玛购物广场嘉兴双溪路分店,浙江省嘉兴市南湖区双溪路与广益路交汇处中港城购物中心地上一层二层,嘉兴,浙江省嘉兴市南湖区景宜路
沃尔玛, 沃尔玛购物广场嘉兴华庭店,浙江省嘉兴市南湖区建国中路华庭街地下一层 沃尔玛购物广场超市,嘉兴,浙江省嘉兴市南湖区景宜路
沃尔玛,沃尔玛购物广场宁波四明中路分店,宁波市鄞州区四明中路999号,宁波,浙江省宁波市鄞州区锦寓路771-773号
沃尔玛, 沃尔玛购物广场宁波联丰店,宁波市海曙区环城西路南段256号,宁波,浙江省宁波市海曙区灵桥路203弄-4号
沃尔玛, 沃尔玛购物广场宁波华侨店,宁波市中兴路671-679号,宁波,浙江省宁波市江东区中兴路8号
沃尔玛,沃尔玛购物广场杭州临平分店,浙江省杭州市余杭区临平藕花洲大街303号莱蒙商业中心二层及三层,余杭,浙江省杭州市余杭区西大街33号
沃尔玛,沃尔玛购物广场桐乡振兴中路分店,桐乡市梧桐街道振兴中路2号润丰新世界广场地上第二层及地上第三层,桐乡,浙江省嘉兴市桐乡市振兴中路4号
沃尔玛,沃尔玛购物广场丽水解放街分店,浙江省丽水市莲都区解放街198号,丽水,浙江省丽水市莲都区解放街59-15号
沃尔玛,沃尔玛购物广场德清永安街分店,浙江省湖州市德清县武康镇永安街158号,德清,浙江省湖州市德清县千秋东街
沃尔玛,沃尔玛购物广场海宁联合路分店,浙江省海宁市海州街道联合路97号,海宁,浙江省嘉兴市海宁市联塘路23号
沃尔玛,沃尔玛购物广场绍兴柯桥笛扬路分店,绍兴市柯桥笛扬路1398号蓝天市心广场地下第一层,绍兴,浙江省绍兴市绍兴县兴华路
沃尔玛,沃尔玛购物广场余姚城东路分店,浙江省余姚市城东路与文山路交叉口家悦广场地上二三层,余姚,浙江省宁波市余姚市城东南路10号
沃尔玛,沃尔玛购物广场临安钱王街分店,浙江省临安市钱王街855号万华广场2楼,临安,浙江省杭州市临安市临水路411号
沃尔玛,沃尔玛购物广场乐清伯乐东路分店,乐清市伯乐东路666号南虹广场B1001号,乐清, 浙江省温州市乐清市 
沃尔玛,沃尔玛购物广场湖州二环东路分店,浙江省湖州市吴兴区二环东路1218,湖州,浙江省湖州市吴兴区吴兴大道1
沃尔玛,沃尔玛购物广场兰溪丹溪大道分店,浙江省兰溪市丹溪大道157号地下一层,兰溪,浙江省金华市兰溪市丹溪大道189号
沃尔玛,沃尔玛购物广场平阳鳌áo江分店,中国浙江省温州市平阳县鳌江镇车站大道1188号,温州,浙江省温州市平阳县解放街147号
沃尔玛,沃尔玛购物广场苍南分店,浙江省温州市苍南县灵溪镇玉苍路1088号银泰城负一层,温州,浙江省温州市苍南县人民大道西
沃尔玛, 沃尔玛购物广场温州东海店,温州市鹿城区民航路体育中心体育馆一层,温州,浙江省温州市鹿城区广场路184号
沃尔玛, 沃尔玛购物广场温州鸿锳分店,温州市解放南路鸿鍈大厦1-3层,温州,浙江省温州市瑞安市解放南路112号
沃尔玛, 沃尔玛购物广场温州欧洲城店,温州市飞霞北路东侧欧洲城H幢2-3层,温州,浙江省温州市鹿城区黎明西路367号
沃尔玛, 沃尔玛购物广场义乌世纪店,义乌市绣湖广场地下商城负二楼沃尔玛,义乌,  浙江省金华市义乌市
